landinUrl,name,space,image,Bread,stock,price,Processor,Graphics,Display,Memory,Storage
https://www.lenovo.com/us/en/p/laptops/thinkpad/thinkpadx1/X1-Yoga-G6/22TP2X1X1Y6,ThinkPad X1 Yoga Gen 6 | 2 in 1 Business Laptop,"14 redesigned 6th generation, 2-in-1 business laptopDesigned on Intel® Evo™ vPro® platformImpressive 16:10 displayWider TouchPadLarger battery for more time unpluggedA super-responsive device for entertainment, teleconferencing, note taking & sketchingNew Storm Gray chassis with tone-matched keyboardEquipped with a built-in garaged penPerfect for business and creative professionals alike",https://p1-ofp.static.pub/fes/cms/2022/03/16/v4dwxvugc90n6gf9oj2tddwevhiwsb899818.png||https://p2-ofp.static.pub/fes/cms/2022/03/16/te0f46qyrb1r0uh9tvu2ofhiwdxwwn224817.png||https://p2-ofp.static.pub/fes/cms/2022/03/16/53ggu2bit67c64jzwh9bbogfpa2n0w242357.png||https://p1-ofp.static.pub/fes/cms/2022/03/16/akkynp2ghxqiyoc9bkyppdeautnpbn945513.png||https://p2-ofp.static.pub/fes/cms/2022/03/16/3vx9z9q5hp4m923unggnwth2k7kj1k898079.png||https://p3-ofp.static.pub/fes/cms/2022/03/16/5lja5m8e0mgw41k3yn7f58ax9usdf8594838.png||https://p3-ofp.static.pub/fes/cms/2022/03/16/5bvymxrx7wpkd3dqjs4hkpmq1llbwe572389.png||https://p3-ofp.static.pub/fes/cms/2022/03/16/9yaj9o3fp9hgw5ggj1iba0d3hyisvl010821.png||https://p3-ofp.static.pub/fes/cms/2022/03/16/mowriqvqzuzhmi0077igncl9wu41fe494387.png||https://p3-ofp.static.pub/fes/cms/2022/03/16/uoj1a06qn1dprtqf4y0qrdhmhjb15m804347.png,Home>Laptops>ThinkPad>X1 Series,"In Stock,",1515.78,"11th Generation Intel® Core™ i5-1135G7 Processor (2.40 GHz, up to 4.20 GHz with Turbo Boost, 4 Cores, 8 Threads, 8 MB Cache)11th Generation Intel® Core™ i7-1165G7 Processor (2.80 GHz, up to 4.70 GHz with Turbo Boost, 4 Cores, 8 Threads, 12 MB Cache)11th Generation Intel® Core™ i7-1185G7 Processor with vPro® (3.00 GHz, up to 4.80 GHz with Turbo Boost, 4 Cores, 8 Threads, 12 MB Cache)",,,,
https://www.lenovo.com/us/en/p/laptops/yoga/yoga-2-in-1-series/Yoga-6-Gen-7-(13-inch-AMD)/LEN101Y0014,Yoga 6 (13” AMD) 2 in 1 Laptop,"Thin & light design with touchscreen that brings entertainment to life in multiple modesPortable companion with lightning-fast responsiveness & efficient battery lifeEco-friendly - Energy Star® and EPEAT® Silver certified & made from recycled aluminumStay fully immersed in your entertainment or projects with premium visuals & sound from Dolby Vision™ & Dolby Atmos®Log in securately with an FHD infrared camera, create mind-blowing content with an optional digital pen (not included)",https://p2-ofp.static.pub/ShareResource/na/subseries/hero/lenovo-yoga-6-13inch-amd-fabric-cover.png||https://p4-ofp.static.pub/ShareResource/na/subseries/gallery/lenovo-yoga-6-gen-7-amd-02.png||https://p1-ofp.static.pub/ShareResource/na/subseries/gallery/lenovo-yoga-6-gen-7-amd-01.png||https://p3-ofp.static.pub/ShareResource/na/subseries/gallery/lenovo-yoga-6-gen-7-amd-03.png||https://p2-ofp.static.pub/ShareResource/na/subseries/gallery/lenovo-yoga-6-gen-7-amd-05.png||https://p3-ofp.static.pub/ShareResource/na/products/yoga/1060x596/lenovo-yoga-6-13-inch-amd-fabric-cover-06.png ,Home>Laptops>Yoga>2-in-1 Series,"In Stock,",749.99,"AMD Ryzen™ 5 5500U Processor (2.10 GHz, up to 4.00 GHz Max Boost, 6 Cores, 12 Threads, 8 MB Cache)AMD Ryzen™ 7 5700U Processor (1.80 GHz, up to 4.30 GHz Max Boost, 8 Cores, 16 Threads, 8 MB Cache)",,,,
https://www.lenovo.com/us/en/p/laptops/ideapad/ideapad-flex-series/IdeaPad-Flex-5i-Gen-7-(14-inch-Intel)/LEN101I0039,IdeaPad Flex 5i (14” Intel) 2 in 1 Laptop,"Versatile 14"" 2-in-1 laptop that you can use in four different waysMultitask seamlessly with cutting-edge Intel® Core™ processing Ample super quick memory & storage, plus a fast-charging batteryEnjoy lightning-quick Intel® Thunderbolt™ 4.0 & PCIe SSD storage technology",https://p4-ofp.static.pub/ShareResource/na/subseries/hero/lenovo-ideapad-flex-5i-gen-7.png||https:https://p1-ofp.static.pub/ShareResource/na/products/ideapad/560x450/lenovo-ideapad-flex-5i-14-intel-stone-blue.png||https://p4-ofp.static.pub/fes/cms/2022/02/07/hxh75nw6j2mps6m8hhkkucj9ow6su7492946.png||https://p3-ofp.static.pub/ShareResource/na/subseries/gallery/lenovo-ideapad-flex-5i-gen-7-04.png||https://p2-ofp.static.pub/ShareResource/na/subseries/gallery/lenovo-ideapad-flex-5i-gen-7-02.png||https://p4-ofp.static.pub/ShareResource/na/subseries/gallery/lenovo-ideapad-flex-5i-gen-7-03.png||https://p4-ofp.static.pub/ShareResource/na/subseries/gallery/lenovo-ideapad-flex-5i-gen-7-01.png||https://p3-ofp.static.pub/ShareResource/na/subseries/gallery/lenovo-ideapad-flex-5i-gen-7-05.png||https://p2-ofp.static.pub/ShareResource/na/subseries/gallery/lenovo-ideapad-flex-5i-gen-7-06.png||https://p3-ofp.static.pub/fes/cms/2022/02/07/u1bkk2hiy1xpdzu50m98ej9iwuo58f016367.png,Home>Laptops>IdeaPad>Flex Series,"In Stock,",749.99,"12th Generation Intel® Core™ i5-1235U Processor (E-Core Max 3.30 GHz, P-Core Max 4.40 GHz with Turbo Boost, 10 Cores, 12 Threads, 12 MB Cache)12th Generation Intel® Core™ i7-1255U Processor (E-Core Max 3.50 GHz, P-Core Max 4.70 GHz with Turbo Boost, 10 Cores, 12 Threads, 12 MB Cache)12th Generation Intel® Core™ i3-1215U Processor (E-Core Max 3.30 GHz, P-Core Max 4.40 GHz with Turbo Boost, 6 Cores, 8 Threads, 10 MB Cache)",,,,
https://www.lenovo.com/us/en/p/laptops/yoga/yoga-2-in-1-series/Yoga-7i-(15)/88YGC701457,Yoga 7i (15” Intel) 2 in 1 Laptop,"Designed on Intel® Evo™ platform that provides enhanced performance & responsiveness15.6 inch FHD display with Dolby Vision™ and Intel® Iris® Xe graphics, your visuals will pop.Modern 2 in 1 laptop crafted from sandblasted and anodized metalIncredible battery life, thanks to Intelligent Cooling optimizationPlay over 100 high-quality PC games with your new Yoga laptop and 3 free months of Xbox Game Pass",https://p2-ofp.static.pub/fes/cms/2022/03/16/n9p917hnlg00xzre6zo6stc4ahaehg099985.png||https://p1-ofp.static.pub/fes/cms/2022/03/16/dq1sfpwuasallx1sbilf0h9fjtiyap642240.png||https://p3-ofp.static.pub/fes/cms/2021/11/14/35kb983s3pnojjkfjd3bqs3q0ggy99120282.png||https://p3-ofp.static.pub/fes/cms/2021/11/14/3d3b8zwrh7vul47gtsob7xzig0bzzs982788.png||https://p1-ofp.static.pub/medias/bWFzdGVyfHJvb3R8OTk3Mzl8aW1hZ2UvanBlZ3xoNWUvaDk0LzExMDQwMTU3NTY0OTU4LmpwZ3xlZGY4YTFiMmE2ZDU2NzdiZTdmMDkxYjI2MmNkMTg2YWVmN2NjZDI1YTRkODQwODNkNzg2YTQ3MmE1ZDI2NDA5/lenovo-laptops-yoga-yoga-c-series-7i-15.6-subseries-gallery-3.jpg||https://p1-ofp.static.pub/medias/bWFzdGVyfHJvb3R8Mjg4OTYyfGltYWdlL2pwZWd8aDM2L2hiZS8xMTAyMjgwODYxMjg5NC5qcGd8YWY5ZDhiYzhmNmU2OGYwMDUyMzRhNGRlMDkzNDRiODNjN2Q5MTI5MmRmODZhMDMxMWY2NzVmNDJhMjMyYzQxYg/lenovo-laptops-yoga-yoga-c-series-7i-15.6-subseries-gallery-4.jpg||https://p4-ofp.static.pub/fes/cms/2021/11/14/aixqyx1duuh7igibqozbqxwcovuehs394322.png||https://p1-ofp.static.pub/fes/cms/2021/11/14/wv7phzs40jxkyx2gxr73jv1fs4f8w1869728.png||https://p1-ofp.static.pub/medias/bWFzdGVyfHJvb3R8MjAwMzg2fGltYWdlL2pwZWd8aGRjL2g2OS8xMTA0MDE1MjY0OTc1OC5qcGd8YTBhNWEyYjM1NzBlYzEyNmZiNTQxN2Y1MmMyMTIwMTEyY2MxMWE2ZTNhYjU0Mzg4NTQ3YjdmMWFhNmJhMzdhYg/lenovo-laptops-yoga-yoga-c-series-7i-15.6-subseries-gallery-7.jpg||https://p1-ofp.static.pub/medias/bWFzdGVyfHJvb3R8MjAxODYxfGltYWdlL2pwZWd8aDQxL2hlMC8xMTA0MDE1MjI4OTMxMC5qcGd8M2ZlMjM0MGVmZDA5M2VhZTNlNjg0ZDQzNTI1OWU4N2E0MTViMDQwOTUyNmY1NDY3YjU2YjAzYmEzMDM4YjkzYQ/lenovo-laptops-yoga-yoga-c-series-7i-15.6-subseries-gallery-8.jpg||https://p4-ofp.static.pub/fes/cms/2021/11/14/miblbcc15g5m083n8s4x6pv9lwinrn884590.png||https://p1-ofp.static.pub/medias/bWFzdGVyfHJvb3R8MTAyNjUwfGltYWdlL2pwZWd8aDA1L2hjOC8xMTA0MDE1MTYzMzk1MC5qcGd8N2VlNGQ5ODc0NzVhMWZhN2ViZmU3NTMyOWQxZGExZTgxZTA1YWRiMzVmODEzMWE0NzgwMWNmMzg5NWVlOThjMA/lenovo-laptops-yoga-yoga-c-series-7i-15.6-subseries-gallery-10.jpg,Home>Laptops>Yoga>2-in-1 Series,"In Stock,",799.99,"11th Generation Intel® Core™ i5-1135G7 Processor (2.40 GHz, up to 4.20 GHz with Turbo Boost, 4 Cores, 8 Threads, 8 MB Cache)11th Generation Intel® Core™ i7-1165G7 Processor (2.80 GHz, up to 4.70 GHz with Turbo Boost, 4 Cores, 8 Threads, 12 MB Cache)",,,,
https://www.lenovo.com/us/en/p/laptops/ideapad/ideapad-300/IdeaPad-3-Gen-7-(15-inch--AMD)/LEN101I0046,IdeaPad 3 (15” AMD) Laptop,"Powerful performance from the AMD Ryzen™ 5000 Series Mobile ProcessorsFHD IPS touchscreen display provides 88% active view ratioSecurity via a 2-in-1 fingerprint readerCrystal-clear HD 720p camera for video conferencingDurable battery life, up to 9 hours on a single chargeSuperb connectivity up to WiFi 6 and Bluetooth® 5.1Play over 100 high-quality PC games with your new IdeaPad laptop and 3 free months of Xbox Game Pass (select models)",https://p1-ofp.static.pub/fes/cms/2022/04/11/pbjw6q5qg1ayu6umbh4ohl9ntiqpz1446975.png||https://p4-ofp.static.pub/fes/cms/2022/04/11/vbgdwymvpawxu6whfvgftvfccwyica453185.jpg||https://p4-ofp.static.pub/fes/cms/2022/04/11/lwhvpa23n0vcpi5ht1aogit28j8jbc058994.jpg||https://p1-ofp.static.pub/fes/cms/2022/04/11/37t2hh5wtvemfhma3yv2sh7ga9t0jf820713.jpg||https://p1-ofp.static.pub/fes/cms/2022/04/11/ezv25ts4bdqy8da3gjoaey8pkpat28957248.jpg||https://p4-ofp.static.pub/fes/cms/2022/04/11/gx5i26wulo84ogfqru58ji0kgz165p837309.jpg||https://p4-ofp.static.pub/fes/cms/2022/04/11/6uq5vugo2hec17fgsde2go4m6jjyar898760.jpg,Home>Laptops>IdeaPad>IdeaPad 300 Series,"In Stock,",559.99,"AMD Ryzen™ 3 5425U Processor (2.70 GHz up to 4.10 GHz Max Boost, 4 Cores, 8 Threads, 8 MB Cache)AMD Ryzen™ 5 5625U Processor (2.30 GHz, up to 4.30 GHz Max Boost, 6 Cores, 12 Threads, 16 MB Cache)AMD Ryzen™ 7 5825U Processor (2.00 GHz, up to 4.50 GHz Max Boost, 8 Cores, 16 Threads, 16 MB Cache)",,,,
